Symbol,Name,Last Sale,Net Change,% Change,Market Cap,Country,IPO Year,Volume,Sector,Industry
DLHC,DLH Holdings Corp.,$5.53,0.07,1.282%,79557168.00,United States,,53997,Consumer Discretionary,Professional Services
DLNG,Dynagas LNG Partners LP Common Units,$3.68,0.03,0.822%,134974238.00,Greece,,21470,Consumer Discretionary,Marine Transportation
DLNG^A,Dynagas LNG Partners LP 9.00% Series A Cumulative Redeemable Preferred Units,$25.4954,0.1354,0.534%,,Greece,,1960,,
DLNG^B,Dynagas LNG Partners LP 8.75% Series B Fixed to Floating Rate Cumulative Redeemable Perpetual Preferred Units liquidation preference $25.00 per Uni,$25.2201,0.0101,0.04%,,Greece,,4142,,
DLO,DLocal Limited Class A Common Shares,$10.27,-0.12,-1.155%,2931829647.00,Uruguay,2021,694931,Consumer Discretionary,Business Services
DLPN,Dolphin Entertainment Inc. Common Stock,$1.20,-0.02,-1.639%,13401743.00,United States,,17127,Consumer Discretionary,Other Consumer Services
DLR,Digital Realty Trust Inc. Common Stock,$176.53,0.69,0.392%,59453801553.00,United States,2004,1924823,Real Estate,Real Estate Investment Trusts
DLR^J,Digital Realty Trust Inc. 5.250% Series J Cumulative Redeemable Preferred Stock,$21.25,0.01,0.047%,,United States,,4702,,
DLR^K,Digital Realty Trust Inc. 5.850% Series K Cumulative Redeemable Preferred Stock par value $0.01 per share,$23.50,0.05,0.213%,,United States,,10185,,
DLR^L,Digital Realty Trust Inc. 5.200% Series L Cumulative Redeemable Preferred Stock,$20.39,0.07,0.344%,,United States,,21257,,
DLTH,Duluth Holdings Inc. Class B Common Stock,$1.94,-0.06,-3.00%,72902988.00,United States,2015,59662,Consumer Discretionary,Clothing/Shoe/Accessory Stores
DLTR,Dollar Tree Inc. Common Stock,$96.09,1.88,1.996%,20053581152.00,United States,1995,2506417,Consumer Discretionary,Department/Specialty Retail Stores
DLX,Deluxe Corporation Common Stock,$15.31,-0.14,-0.906%,684966950.00,United States,,299973,Consumer Discretionary,Publishing
DLY,DoubleLine Yield Opportunities Fund Common Shares of Beneficial Interest,$15.70,0.03,0.191%,752748730.00,United States,2020,199589,Finance,Investment Managers
DMA,Destra Multi-Alternative Fund Common Stock,$8.70,-0.0299,-0.343%,0.00,,2022,4798,Finance,Trusts Except Educational Religious and Charitable
DMAA,Drugs Made In America Acquisition Corp. Ordinary Shares,$10.17,0.00,0.00%,0.00,United States,2025,2226,,
DMAAR,Drugs Made In America Acquisition Corp. Rights,$0.15,0.00,0.00%,0.00,United States,2025,126,Finance,Blank Checks
DMAAU,Drugs Made In America Acquisition Corp. Units,$10.29,0.00,0.00%,0.00,United States,2025,1151,,
DMAC,DiaMedica Therapeutics Inc. Common Stock,$3.90,-0.13,-3.226%,167245514.00,United States,2018,85686,Health Care,Biotechnology: Pharmaceutical Preparations
DMB,BNY Mellon Municipal Bond Infrastructure Fund Inc. Common Stock,$10.06,-0.02,-0.198%,0.00,,2013,127246,Finance,Trusts Except Educational Religious and Charitable
DMF,BNY Mellon Municipal Income Inc. Common Stock,$6.93,0.03,0.435%,431675618.00,United States,1988,85394,Finance,Finance/Investors Services
DMLP,Dorchester Minerals L.P. Common Units Representing Limited Partnership Interests,$28.31,0.16,0.568%,1340188492.00,United States,,84123,Energy,Oil & Gas Production
DMO,Western Asset Mortgage Opportunity Fund Inc. Common Stock,$11.85,0.0104,0.088%,0.00,United States,2010,54722,Finance,Trusts Except Educational Religious and Charitable
DMRC,Digimarc Corporation Common Stock,$13.27,-0.18,-1.338%,285995053.00,United States,,135366,Technology,EDP Services
DMYY,dMY Squared Technology Group Inc. Class A Common Stock,$14.58,-0.11,-0.749%,0.00,,2022,24171,Finance,Blank Checks
DNA,Ginkgo Bioworks Holdings Inc. Class A Common Stock,$9.29,-0.49,-5.01%,543761137.00,United States,2021,1196379,Health Care,Biotechnology: Biological Products (No Diagnostic Substances)
DNB,Dun & Bradstreet Holdings Inc. Common Stock,$9.06,-0.01,-0.11%,4044606650.00,United States,2020,3889091,Finance,Finance: Consumer Services
DNLI,Denali Therapeutics Inc. Common Stock,$14.925,-0.265,-1.745%,2168248763.00,United States,2017,1935800,Health Care,Biotechnology: Biological Products (No Diagnostic Substances)
DNN,Denison Mines Corp Ordinary Shares (Canada),$1.62,-0.01,-0.613%,1452078156.00,Canada,,157228659,Basic Materials,Other Metals and Minerals
DNOW,DNOW Inc. Common Stock,$15.04,-0.06,-0.397%,1587745277.00,United States,2014,548485,Industrials,Metal Fabrications
DNP,DNP Select Income Fund Inc. Common Stock,$9.77,0.03,0.308%,0.00,United States,1987,626763,Finance,Investment Managers
DNTH,Dianthus Therapeutics Inc. Common Stock,$19.29,1.17,6.457%,620366053.00,United States,2018,465385,Health Care,Biotechnology: Pharmaceutical Preparations
DNUT,Krispy Kreme Inc. Common Stock,$2.73,-0.07,-2.50%,466284000.00,United States,2021,2727138,Consumer Staples,Food Chains
DOC,Healthpeak Properties Inc. Common Stock,$17.50,-0.01,-0.057%,12157811855.00,United States,,4496914,Real Estate,Real Estate Investment Trusts
DOCN,DigitalOcean Holdings Inc. Common Stock,$28.20,-0.68,-2.355%,2567145490.00,United States,2021,1249381,Technology,Computer Software: Programming Data Processing
DOCS,Doximity Inc. Class A Common Stock,$56.95,-0.52,-0.905%,10696699413.00,United States,2021,1685268,Technology,EDP Services
DOCU,DocuSign Inc. Common Stock,$76.01,-0.23,-0.302%,15358791300.00,United States,1989,3487154,Technology,Computer Software: Prepackaged Software
DOGZ,Dogness (International) Corporation Class A Common Stock,$27.84,2.33,9.134%,354421519.00,China,2017,583807,Consumer Discretionary,Miscellaneous manufacturing industries
DOLE,Dole plc Ordinary Shares,$14.23,0.42,3.041%,1353814224.00,Ireland,2021,900566,Consumer Staples,Farming/Seeds/Milling
DOMH,Dominari Holdings Inc. Common Stock,$5.26,0.02,0.382%,77343277.00,United States,,89046,Health Care,Biotechnology: Pharmaceutical Preparations
DOMO,Domo Inc. Class B Common Stock,$13.69,0.12,0.884%,550818081.00,United States,2018,527686,Technology,Computer Software: Prepackaged Software
DOOO,BRP Inc. (Recreational Products) Common Subordinate Voting Shares,$48.83,-0.33,-0.671%,3571037220.00,Canada,,313140,Consumer Discretionary,Industrial Specialties
DORM,Dorman Products Inc. Common Stock,$128.24,0.98,0.77%,3912752954.00,United States,,129057,Consumer Discretionary,Auto Parts:O.E.M.
DOUG,Douglas Elliman Inc. Common Stock,$2.90,0.25,9.434%,257339730.00,United States,2021,621528,Finance,Real Estate
DOV,Dover Corporation Common Stock,$178.78,-0.36,-0.201%,24511518732.00,United States,,768722,Industrials,Industrial Machinery/Components
DOW,Dow Inc. Common Stock ,$30.14,-0.54,-1.76%,21304812783.00,United States,2019,6817248,Industrials,Major Chemicals
DOX,Amdocs Limited Ordinary Shares,$94.08,0.58,0.62%,10620744261.00,Guernsey,,598601,Technology,EDP Services
DOYU,DouYu International Holdings Limited ADS,$6.58,-0.03,-0.454%,198576892.00,China,2019,26302,Technology,Computer Software: Programming Data Processing
DPG,Duff & Phelps Utility and Infrastructure Fund Inc.,$12.30,0.06,0.49%,0.00,United States,2011,70634,Finance,Trusts Except Educational Religious and Charitable
DPRO,Draganfly Inc. Common Shares,$2.41,-0.07,-2.823%,13121951.00,Canada,,1760028,Industrials,Aerospace
DPZ,Domino's Pizza Inc Common Stock,$451.00,4.10,0.917%,15442906127.00,United States,2004,538619,Consumer Discretionary,Food Distributors
DQ,DAQO New Energy Corp. American Depositary Shares each representing five ordinary shares,$14.23,-0.32,-2.199%,954217054.00,China,2010,550582,Technology,Semiconductors
DRCT,Direct Digital Holdings Inc. Class A Common Stock,$0.5319,-0.0139,-2.547%,10059016.00,United States,2022,127331,Consumer Discretionary,Advertising
DRD,DRDGOLD Limited American Depositary Shares,$14.32,0.28,1.994%,1238091033.00,South Africa,,551701,Basic Materials,Precious Metals
DRDB,Roman DBDR Acquisition Corp. II Ordinary shares,$10.39,0.04,0.386%,0.00,United States,2025,34941,,
DRDBU,Roman DBDR Acquisition Corp. II Unit,$10.664,0.064,0.604%,0.00,United States,2024,938,,
DRDBW,Roman DBDR Acquisition Corp. II Warrants,$0.41,-0.09,-18.00%,0.00,United States,2025,24400,,
DRH,Diamondrock Hospitality Company Common Stock,$7.74,-0.03,-0.386%,1596849044.00,United States,2005,2037019,Real Estate,Real Estate Investment Trusts
DRH^A,Diamondrock Hospitality Company 8.250% Series A Cumulative Redeemable Preferred Stock,$25.30,0.06,0.238%,,United States,,1855,,
DRI,Darden Restaurants Inc. Common Stock,$217.81,0.14,0.064%,25489486641.00,United States,,783288,Consumer Discretionary,Restaurants
DRIO,DarioHealth Corp. Common Stock,$0.6975,-0.0225,-3.125%,30654723.00,Israel,,63178,Health Care,Medical/Dental Instruments
DRMA,Dermata Therapeutics Inc. Common Stock,$0.734,-0.04,-5.168%,4681539.00,United States,2021,103618,Health Care,Biotechnology: Pharmaceutical Preparations
DRMAW,Dermata Therapeutics Inc. Warrant,$0.0177,0.0002,1.143%,112893.00,United States,2021,10046,Health Care,Biotechnology: Pharmaceutical Preparations
DRRX,DURECT Corporation Common Stock,$0.64,0.04,6.667%,19867252.00,United States,2000,108346,Health Care,Biotechnology: Pharmaceutical Preparations
DRS,Leonardo DRS Inc. Common Stock,$45.29,0.65,1.456%,12049368494.00,Israel,,731944,Industrials,Industrial Machinery/Components
DRTS,Alpha Tau Medical Ltd. Ordinary Shares,$3.07,0.00,0.00%,216068350.00,Israel,,17522,Health Care,Medical/Dental Instruments
DRTSW,Alpha Tau Medical Ltd. Warrant,$0.245,0.0165,7.221%,17243240.00,Israel,,101,Health Care,Medical/Dental Instruments
DRUG,Bright Minds Biosciences Inc. Common Stock,$28.38,0.63,2.27%,198347508.00,Canada,,7889,Health Care,Biotechnology: Pharmaceutical Preparations
DRVN,Driven Brands Holdings Inc. Common Stock,$17.34,-0.21,-1.197%,2848534725.00,United States,2021,621721,Consumer Discretionary,Automotive Aftermarket
DSGN,Design Therapeutics Inc. Common Stock,$3.91,0.01,0.256%,221965531.00,United States,2021,39687,Health Care,Biotechnology: Pharmaceutical Preparations
DSGR,Distribution Solutions Group Inc. Common Stock,$27.77,-0.235,-0.839%,1289592730.00,United States,,54613,Consumer Discretionary,Industrial Specialties
DSGX,Descartes Systems Group Inc. (The) Common Stock,$100.67,1.97,1.996%,8596225595.00,Canada,,415067,Technology,Computer Software: Prepackaged Software
DSL,DoubleLine Income Solutions Fund Common Shares of Beneficial Interests,$12.33,0.02,0.162%,1257620889.00,United States,2013,211744,Finance,Trusts Except Educational Religious and Charitable
DSM,BNY Mellon Strategic Municipal Bond Fund Inc. Common Stock,$5.60,-0.02,-0.356%,0.00,United States,1989,133626,Finance,Investment Managers
DSP,Viant Technology Inc. Class A Common Stock,$13.12,-0.33,-2.454%,820873582.00,United States,2021,318985,Technology,Computer Software: Programming Data Processing
DSS,DSS Inc. Common Stock,$0.9702,0.0302,3.213%,8821561.00,United States,,11754,Consumer Discretionary,Containers/Packaging
DSU,Blackrock Debt Strategies Fund Inc. Common Stock,$10.57,0.00,0.00%,0.00,United States,1998,279431,Finance,Finance Companies
DSWL,Deswell Industries Inc. Common Shares,$2.35,-0.02,-0.844%,37447812.00,Macau,1995,21969,Industrials,Plastic Products
DSX,Diana Shipping inc. common stock,$1.61,0.00,0.00%,186386256.00,Greece,2005,277629,Consumer Discretionary,Marine Transportation
DSX^B,Diana Shipping Inc. Perpetual Preferred Shares Series B (Marshall Islands),$26.645,-0.1217,-0.455%,,Greece,,1289,,
DSY,Big Tree Cloud Holdings Limited Ordinary Shares,$1.3291,-0.0189,-1.402%,75865754.00,China,,1402,Consumer Discretionary,Containers/Packaging
DSYWW,Big Tree Cloud Holdings Limited Warrants,$0.0207,0.001,5.076%,1181567.00,China,,25177,Consumer Discretionary,Containers/Packaging
DT,Dynatrace Inc. Common Stock,$54.03,0.16,0.297%,16190997420.00,United States,2019,1645996,Technology,Computer Software: Prepackaged Software
DTB,DTE Energy Company 2020 Series G 4.375% Junior Subordinated Debentures due 2080,$17.34,0.04,0.231%,3598321926.00,United States,2020,13824,Utilities,Electric Utilities: Central
DTCK,Davis Commodities Limited Ordinary Shares,$0.78,0.12,18.182%,19110488.00,Singapore,2023,348024,Industrials,Farming/Seeds/Milling
DTE,DTE Energy Company Common Stock,$136.03,1.06,0.785%,28228358222.00,United States,,1037954,Utilities,Electric Utilities: Central
DTF,DTF Tax-Free Income 2028 Term Fund Inc. Common Stock,$11.245,0.035,0.312%,79047481.00,United States,1991,5988,Finance,Investment Managers
DTG,DTE Energy Company 2021 Series E 4.375% Junior Subordinated Debentures,$17.01,-0.04,-0.235%,3529841751.00,United States,2021,21573,Utilities,Electric Utilities: Central
DTI,Drilling Tools International Corporation Common Stock,$3.12,-0.18,-5.455%,111049339.00,United States,2021,48532,Industrials,Metal Fabrications
DTIL,Precision BioSciences Inc. Common Stock,$5.03,-0.04,-0.789%,55773817.00,United States,2019,35633,Health Care,Biotechnology: Biological Products (No Diagnostic Substances)
DTM,DT Midstream Inc. Common Stock ,$106.24,0.73,0.692%,10792994481.00,United States,2021,529560,Utilities,Natural Gas Distribution
DTSS,Datasea Inc. Common Stock,$2.10,-0.14,-6.25%,16073129.00,China,,214794,Technology,Computer Software: Prepackaged Software
DTST,Data Storage Corporation Common Stock,$3.615,0.02,0.556%,25810713.00,United States,,68053,Technology,EDP Services
DTSTW,Data Storage Corporation Warrant,$0.2399,-0.0201,-7.731%,1712860.00,United States,,12685,Technology,EDP Services
DTW,DTE Energy Company 2017 Series E 5.25% Junior Subordinated Debentures due 2077,$21.28,-0.07,-0.328%,4415933713.00,United States,2017,12236,Utilities,Electric Utilities: Central
DUK,Duke Energy Corporation (Holding Company) Common Stock,$117.28,0.93,0.799%,91156713509.00,United States,,2432533,Utilities,Power Generation
DUK^A,Duke Energy Corporation Depositary Shares each representing a 1/1000th interest in a share of 5.75% Series A Cumulative Redeemable Perpetual Preferred Stock,$24.58,-0.06,-0.244%,,United States,,44093,,
DUKB,Duke Energy Corporation 5.625% Junior Subordinated Debentures due 2078,$24.52,-0.04,-0.163%,19058344264.00,United States,2018,26707,Utilities,Power Generation
DUO,Fangdd Network Group Ltd. Class A Ordinary Shares,$2.66,0.19,7.692%,10386143.00,China,2019,304967,Finance,Real Estate
DUOL,Duolingo Inc. Class A Common Stock,$481.48,7.70,1.625%,21885309883.00,United States,2021,651453,Technology,Computer Software: Prepackaged Software
DUOT,Duos Technologies Group Inc. Common Stock,$7.96,-0.35,-4.212%,92765084.00,United States,,42448,Technology,Computer Software: Prepackaged Software
DV,DoubleVerify Holdings Inc. Common Stock,$14.92,-0.03,-0.201%,2424538807.00,United States,2021,3256134,Technology,Computer Software: Programming Data Processing
DVA,DaVita Inc. Common Stock,$137.35,-0.82,-0.593%,10369925000.00,United States,,852675,Health Care,Misc Health and Biotechnology Services
DVAX,Dynavax Technologies Corporation Common Stock,$10.40,0.22,2.161%,1248838760.00,United States,2004,1073508,Health Care,Biotechnology: Pharmaceutical Preparations
DVLT,Datavault AI Inc. Common Stock,$0.833,-0.0069,-0.822%,54998150.00,United States,2018,527058,Technology,Semiconductors
DVN,Devon Energy Corporation Common Stock,$34.33,-0.14,-0.406%,22043293000.00,United States,1985,6149477,Energy,Oil & Gas Production
DVS,Dolly Varden Silver Corporation Common Shares,$3.57,0.10,2.882%,284236428.00,,2025,397149,,
DWSN,Dawson Geophysical Company Common Stock,$1.37,0.05,3.788%,42448302.00,United States,,1939,Energy,Oil & Gas Production
DWTX,Dogwood Therapeutics Inc. Common Stock,$5.18,0.36,7.469%,9899643.00,United States,2020,104388,Health Care,Biotechnology: Pharmaceutical Preparations
DX,Dynex Capital Inc. Common Stock,$12.40,0.09,0.731%,1306109856.00,United States,,3719804,Real Estate,Real Estate Investment Trusts
DX^C,Dynex Capital Inc. 6.900% Series C Fixed-to-Floating Rate Cumulative Redeemable Preferred Stock,$25.6314,0.0114,0.044%,,United States,,10227,,
DXC,DXC Technology Company Common Stock ,$15.86,-0.11,-0.689%,2874883581.00,United States,,1366706,Technology,EDP Services
DXCM,DexCom Inc. Common Stock,$82.85,-0.14,-0.169%,32486106458.00,United States,2005,2805698,Health Care,Medical/Dental Instruments
DXF,Eason Technology Limited American Depositary Shares (each representing sixty-thousand (60000) Ordinary Shares),$6.30,-0.26,-3.963%,1571623.00,,,61165,Finance,Finance: Consumer Services
DXLG,Destination XL Group Inc. Common Stock,$1.13,-0.03,-2.586%,60810955.00,United States,,151910,Consumer Discretionary,Clothing/Shoe/Accessory Stores
DXPE,DXP Enterprises Inc. Common Stock,$78.83,-1.385,-1.727%,1237180881.00,United States,,75396,Industrials,Industrial Machinery/Components
DXR,Daxor Corporation Common Stock,$8.79,0.04,0.457%,42543600.00,United States,,3063,Health Care,Medical/Dental Instruments
DXST,Decent Holding Inc Class A Ordinary Shares,$1.36,0.06,4.615%,22100000.00,China,2025,53463,Industrials,Miscellaneous
DXYZ,Destiny Tech100 Inc. Common Stock,$40.26,-0.51,-1.251%,0.00,,2024,308363,,
DY,Dycom Industries Inc. Common Stock,$235.54,-0.92,-0.389%,6812956107.00,United States,,294541,Industrials,Water Sewer Pipeline Comm & Power Line Construction
DYAI,Dyadic International Inc. Common Stock,$0.9442,-0.0558,-5.58%,28411602.00,United States,,31533,Health Care,Biotechnology: Biological Products (No Diagnostic Substances)
DYCQ,DT Cloud Acquisition Corporation Ordinary Shares,$10.80,0.00,0.00%,0.00,United Kingdom,2024,175,,
DYN,Dyne Therapeutics Inc. Common Stock,$14.46,-0.11,-0.755%,1643618718.00,United States,2020,2504531,Health Care,Biotechnology: Pharmaceutical Preparations
DYNX,Dynamix Corporation Class A Ordinary Shares,$10.1395,0.00,0.00%,0.00,United States,2024,20,,
DYNXU,Dynamix Corporation Unit,$10.28,0.00,0.00%,0.00,United States,2024,214,,
E,ENI S.p.A. Common Stock,$32.26,0.52,1.638%,52978832184.00,Italy,,326746,Energy,Oil & Gas Production
EA,Electronic Arts Inc. Common Stock,$150.05,2.37,1.605%,37627434099.00,United States,,1926340,Technology,Computer Software: Prepackaged Software
EAD,Allspring Income Opportunities Fund Common Shares,$6.88,-0.04,-0.578%,0.00,United States,2003,94496,Finance,Finance/Investors Services
EAF,GrafTech International Ltd. Common Stock,$1.20,-0.10,-7.692%,309735548.00,United States,2018,1373794,Energy,Industrial Machinery/Components
EAI,Entergy Arkansas LLC First Mortgage Bonds 4.875% Series Due September 1 2066,$20.43,0.00,0.00%,8800715047.00,United States,2016,11119,Utilities,Electric Utilities: Central
EARN,Ellington Credit Company Common Shares of Beneficial Interest,$5.77,0.04,0.698%,216716555.00,United States,2013,238748,Real Estate,Real Estate Investment Trusts
EAT,Brinker International Inc. Common Stock,$176.29,0.48,0.273%,7836293762.00,United States,,1269236,Consumer Discretionary,Restaurants
EB,Eventbrite Inc. Class A Common Stock,$2.45,-0.06,-2.39%,234928354.00,United States,2018,282161,Technology,Computer Software: Programming Data Processing
EBAY,eBay Inc. Common Stock,$77.44,-0.44,-0.565%,35699840000.00,United States,1998,4679860,Consumer Discretionary,Business Services
EBC,Eastern Bankshares Inc. Common Stock,$15.13,-0.11,-0.722%,3193790898.00,United States,2020,960448,Finance,Savings Institutions
EBF,Ennis Inc. Common Stock,$18.85,0.12,0.641%,491103216.00,United States,,181868,Consumer Discretionary,Office Equipment/Supplies/Services
EBMT,Eagle Bancorp Montana Inc. Common Stock,$16.59,-0.19,-1.132%,131926616.00,United States,2010,20824,Finance,Major Banks
EBON,Ebang International Holdings Inc. Class A Ordinary Shares,$3.73,0.045,1.221%,24408889.00,China,2020,1684,Technology,Semiconductors
EBR,Centrais Electricas Brasileiras S A American Depositary Shares (Each representing one Common Share),$7.46,0.01,0.134%,16731875773.00,Brazil,2016,1236043,Utilities,Electric Utilities: Central
EBS,Emergent BioSolutions Inc. Common Stock,$6.60,-0.07,-1.049%,358233658.00,United States,2006,845891,Health Care,Biotechnology: Pharmaceutical Preparations
EBTC,Enterprise Bancorp Inc Common Stock,$40.94,0.10,0.245%,512093323.00,United States,,11526,Finance,Major Banks
EC,Ecopetrol S.A. American Depositary Shares,$9.33,0.02,0.215%,19180938078.00,Colombia,,1910470,Energy,Oil & Gas Production
ECAT,BlackRock ESG Capital Allocation Term Trust Common Shares of Beneficial Interest,$16.28,-0.03,-0.184%,1760437800.00,United States,2021,556334,Finance,Trusts Except Educational Religious and Charitable
ECBK,ECB Bancorp Inc. Common Stock,$15.19,0.03,0.198%,137130474.00,United States,2022,12450,Finance,Banks
ECC           ,Eagle Point Credit Company Inc. Common Stock,$7.58,-0.09,-1.173%,459821932.00,United States,2014,1045264,Finance,Trusts Except Educational Religious and Charitable
ECC^D,Eagle Point Credit Company Inc. 6.75% Series D Preferred Stock,$19.0369,-0.0431,-0.226%,,United States,,12718,,
ECCC,Eagle Point Credit Company Inc. 6.50% Series C Term Preferred Stock due 2031,$23.07,0.3125,1.373%,1399484429.00,United States,,4012,Finance,Trusts Except Educational Religious and Charitable
ECCF,Eagle Point Credit Company Inc. 8.00% Series F Term Preferred Stock due 2029,$25.02,0.0016,0.006%,27238594157.00,United States,,2652,,
ECCU,Eagle Point Credit Company Inc. 7.75% Notes due 2030,$24.88,-0.02,-0.08%,0.00,United States,2024,4219,,
ECCV,Eagle Point Credit Company Inc. 5.375% Notes due 2029,$23.22,0.06,0.259%,1408583807.00,United States,2022,2431,Finance,Trusts Except Educational Religious and Charitable
ECCW,Eagle Point Credit Company Inc. 6.75% Notes due 2031,$23.65,0.04,0.169%,1434668693.00,United States,2021,1065,Finance,Trusts Except Educational Religious and Charitable
ECCX,Eagle Point Credit Company Inc. 6.6875% Notes due 2028,$24.805,0.055,0.222%,1504733908.00,United States,2022,300,Finance,Trusts Except Educational Religious and Charitable
ECDA,ECD Automotive Design Inc. Common Stock,$0.3241,-0.0023,-0.705%,11468493.00,United States,2022,314675,Consumer Discretionary,Auto Manufacturing
ECDAW,ECD Automotive Design Inc. Warrant ,$0.0137,0.0017,14.167%,484784.00,United States,2022,20000,Consumer Discretionary,Auto Manufacturing
ECF,Ellsworth Growth and Income Fund Ltd.,$9.94,-0.19,-1.876%,0.00,United States,1986,33668,Finance,Finance/Investors Services
ECG,Everus Construction Group Inc. Common Stock,$60.44,0.13,0.216%,3082414676.00,United States,2024,351657,Consumer Discretionary,Homebuilding
ECL,Ecolab Inc. Common Stock,$270.95,3.01,1.123%,76817743847.00,United States,,1156630,Consumer Discretionary,Package Goods/Cosmetics
ECO,Okeanis Eco Tankers Corp. Common Stock,$22.49,0.43,1.949%,724045489.00,,,183363,Consumer Discretionary,Marine Transportation
ECOR,electroCore Inc. Common Stock,$5.37,-0.29,-5.124%,39848719.00,United States,2018,35771,Health Care,Biotechnology: Electromedical & Electrotherapeutic Apparatus
ECPG,Encore Capital Group Inc Common Stock,$38.85,-1.00,-2.509%,907116420.00,United States,,308310,Finance,Finance Companies
ECVT,Ecovyst Inc. Common Stock,$8.01,-0.23,-2.791%,940378085.00,United States,2017,1259939,Industrials,Major Chemicals
ECX,ECARX Holdings Inc. Class A Ordinary shares,$1.59,-0.04,-2.454%,549710741.00,China,,689058,Technology,EDP Services
ECXWW,ECARX Holdings Inc. Warrants,$0.0629,0.0001,0.159%,21746419.00,China,,2103,Technology,EDP Services
ED,Consolidated Edison Inc. Common Stock,$103.76,1.21,1.18%,37384325826.00,United States,,1902564,Utilities,Power Generation
EDAP,EDAP TMS S.A. American Depositary Shares,$1.77,-0.02,-1.117%,66183992.00,France,1997,4881,Health Care,Biotechnology: Electromedical & Electrotherapeutic Apparatus
EDBL,Edible Garden AG Incorporated Common Stock,$3.07,0.07,2.333%,5081660.00,United States,2022,53534,Consumer Staples,Farming/Seeds/Milling
EDBLW,Edible Garden AG Incorporated Warrant,$0.10,0.0106,11.857%,165526.00,United States,2022,50534,Consumer Staples,Farming/Seeds/Milling
EDD,Morgan Stanley Emerging Markets Domestic Debt Fund Inc. Common Stock,$5.06,-0.02,-0.394%,0.00,United States,2007,352467,Finance,Finance Companies
EDF,Virtus Stone Harbor Emerging Markets Income Fund Common Shares of Beneficial Interest,$5.04,-0.04,-0.787%,0.00,United States,2010,141542,Finance,Investment Managers
EDHL,Everbright Digital Holding Limited Ordinary Shares,$5.00,-0.10,-1.961%,132500000.00,Hong Kong,2025,147870,Consumer Discretionary,Advertising
EDIT,Editas Medicine Inc. Common Stock,$2.18,0.15,7.389%,182494033.00,United States,2016,3205125,Health Care,Biotechnology: Biological Products (No Diagnostic Substances)
EDN,Empresa Distribuidora Y Comercializadora Norte S.A. (Edenor) American Depositary Shares,$31.32,0.07,0.224%,1419508687.00,Argentina,2007,51864,Utilities,Electric Utilities: Central
EDRY,EuroDry Ltd. Common Shares ,$8.89,-0.234,-2.565%,25129336.00,Greece,,7196,Consumer Discretionary,Marine Transportation
EDSA,Edesa Biotech Inc. Common Shares,$1.955,0.095,5.108%,6348645.00,United States,,6309,Health Care,Biotechnology: Pharmaceutical Preparations
EDTK,Skillful Craftsman Education Technology Limited Ordinary Share,$0.98,0.0001,0.01%,15610862.00,China,2020,19826,Real Estate,Other Consumer Services
EDU,New Oriental Education & Technology Group Inc. Sponsored ADR representing 10 Ordinary Share (Cayman Islands),$47.62,-0.46,-0.957%,7787243027.00,China,2006,667553,Real Estate,Other Consumer Services
EDUC,Educational Development Corporation Common Stock,$1.36,-0.01,-0.73%,11673153.00,United States,,2790,Consumer Discretionary,Consumer Specialties
EE,Excelerate Energy Inc. Class A Common Stock,$30.75,-0.59,-1.883%,3506059742.00,United States,2022,345845,Utilities,Oil/Gas Transmission
EEA,The European Equity Fund Inc. Common Stock,$10.08,0.05,0.499%,0.00,United States,,22124,Finance,Trusts Except Educational Religious and Charitable
EEFT,Euronet Worldwide Inc. Common Stock,$112.12,-0.62,-0.55%,4848613255.00,United States,1997,316270,Finance,Investment Bankers/Brokers/Service
