Symbol,Name,Last Sale,Net Change,% Change,Market Cap,Country,IPO Year,Volume,Sector,Industry
PYPD,PolyPid Ltd. Ordinary Shares,$3.43,-0.03,-0.867%,34954801.00,Israel,2020,380741,Health Care,Biotechnology: Pharmaceutical Preparations
PYPL,PayPal Holdings Inc. Common Stock,$74.81,0.20,0.268%,72755180937.00,United States,,8644643,Consumer Discretionary,Business Services
PYXS,Pyxis Oncology Inc. Common Stock,$1.22,-0.06,-4.688%,75576151.00,United States,2021,484934,Health Care,Biotechnology: Pharmaceutical Preparations
PZC,PIMCO California Municipal Income Fund III Common Shares of Beneficial Interest,$6.185,0.005,0.081%,0.00,United States,2002,80555,Finance,Investment Managers
PZG,Paramount Gold Nevada Corp. Common Stock,$0.59,-0.0018,-0.304%,42154999.00,United States,2015,93453,Basic Materials,Metal Mining
PZZA,Papa John's International Inc. Common Stock,$50.63,-1.16,-2.24%,1657546964.00,United States,1993,1704496,Consumer Discretionary,Restaurants
QBTS,D-Wave Quantum Inc. Common Shares,$15.88,-0.65,-3.932%,4639997225.00,,2022,49982450,Technology,EDP Services
QCOM,QUALCOMM Incorporated Common Stock,$158.70,-0.78,-0.489%,174252600000.00,United States,1991,5689351,Technology,Radio And Television Broadcasting And Communications Equipment
QCRH,QCR Holdings Inc. Common Stock,$66.59,-0.22,-0.329%,1127463125.00,United States,,81152,Finance,Major Banks
QD,Qudian Inc. American Depositary Shares each representing one Class A Ordinary Share,$2.95,0.00,0.00%,487123151.00,China,2017,108215,Finance,Finance: Consumer Services
QDEL,QuidelOrtho Corporation Common Stock,$29.88,-1.09,-3.52%,2020661055.00,United States,,738727,Health Care,Biotechnology: In Vitro & In Vivo Diagnostic Substances
QETA,Quetta Acquisition Corporation Common Stock,$10.86,0.00,0.00%,0.00,United States,2023,11,Finance,Blank Checks
QFIN,Qifu Technology Inc. American Depositary Shares,$42.00,0.35,0.84%,5893220088.00,China,2018,1297881,Finance,Finance: Consumer Services
QGEN,Qiagen N.V. Common Shares,$47.39,0.67,1.434%,10241742074.00,Netherlands,,1102841,Health Care,Biotechnology: Biological Products (No Diagnostic Substances)
QH,Quhuo Limited American Depository Shares,$1.13,-0.03,-2.586%,101355366.00,China,2020,1363,Consumer Discretionary,Business Services
QIPT,Quipt Home Medical Corp. Common Shares,$2.05,-0.07,-3.302%,89060143.00,United States,,167573,Health Care,Misc Health and Biotechnology Services
QLGN,Qualigen Therapeutics Inc. Common Stock,$3.822,0.024,0.632%,2814639.00,United States,2015,5188,Health Care,Biotechnology: Pharmaceutical Preparations
QLYS,Qualys Inc. Common Stock,$140.68,0.67,0.479%,5110359406.00,United States,2012,194898,Technology,Computer Software: Prepackaged Software
QMCO,Quantum Corporation Common Stock,$10.40,-0.57,-5.196%,60675670.00,United States,,1637990,Technology,Electronic Components
QMMM,QMMM Holdings Limited Class A Ordinary Shares,$1.02,0.01,0.99%,17550469.00,Hong Kong,2024,49057,Consumer Discretionary,Advertising
QNCX,Quince Therapeutics Inc. Common Stock,$1.20,-0.05,-4.00%,54562538.00,United States,2019,1427223,Health Care,Biotechnology: Biological Products (No Diagnostic Substances)
QNRX,Quoin Pharmaceuticals Ltd. American Depositary Shares,$8.47,-0.02,-0.236%,4981766.00,Israel,2016,11775,Health Care,Medical/Dental Instruments
QNST,QuinStreet Inc. Common Stock,$15.51,-0.35,-2.207%,883324357.00,United States,2010,310423,Consumer Discretionary,Business Services
QNTM,Quantum Biopharma Ltd. Class B Subordinate Voting Shares,$19.00,3.63,23.617%,55693731.00,Canada,,520428,Health Care,Biotechnology: Pharmaceutical Preparations
QQQX,Nuveen NASDAQ 100 Dynamic Overwrite Fund Shares of Beneficial Interest,$26.29,0.01,0.038%,0.00,United States,,163543,Finance,Finance Companies
QRHC,Quest Resource Holding Corporation Common Stock,$2.07,-0.08,-3.721%,42717673.00,United States,,101439,Utilities,Environmental Services
QRVO,Qorvo Inc. Common Stock,$81.76,-0.87,-1.053%,7605738635.00,United States,,1275038,Technology,Semiconductors
QS,QuantumScape Corporation Class A Common Stock,$4.49,-0.13,-2.814%,2509579011.00,United States,2020,10008112,Miscellaneous,Industrial Machinery/Components
QSEA,Quartzsea Acquisition Corporation Ordinary Shares,$10.079,0.00,0.00%,0.00,United States,2025,127,Finance,Blank Checks
QSEAU,Quartzsea Acquisition Corporation Units,$10.30,0.015,0.146%,0.00,United States,2025,2004,Finance,Blank Checks
QSG,QuantaSing Group Limited American Depositary Shares,$11.51,-0.55,-4.561%,588310665.00,China,2023,3445686,Real Estate,Other Consumer Services
QSI,Quantum-Si Incorporated Class A Common Stock,$1.79,0.03,1.705%,328461628.00,United States,2020,9407338,Industrials,Industrial Machinery/Components
QSIAW,Quantum-Si Incorporated Warrant,$0.67,-0.0716,-9.655%,122943738.00,United States,2020,9369,Industrials,Industrial Machinery/Components
QSR,Restaurant Brands International Inc. Common Shares,$68.31,0.69,1.02%,31055530340.00,Canada,2014,2600629,Consumer Discretionary,Restaurants
QTRX,Quanterix Corporation Common Stock,$6.19,-0.47,-7.057%,240353899.00,United States,2017,731511,Industrials,Biotechnology: Laboratory Analytical Instruments
QTTB,Q32 Bio Inc. Common Stock,$1.70,0.00,0.00%,20735946.00,United States,2018,57413,Health Care,Biotechnology: Pharmaceutical Preparations
QTWO,Q2 Holdings Inc. Common Stock,$88.47,-0.63,-0.707%,5512020990.00,United States,2014,311428,Technology,Computer Software: Prepackaged Software
QUAD,Quad Graphics Inc Class A Common Stock,$5.41,-0.01,-0.185%,273813641.00,United States,,129437,Consumer Discretionary,Publishing
QUBT,Quantum Computing Inc. Common Stock,$17.51,-1.46,-7.696%,2467220915.00,United States,,60176956,Technology,Computer Software: Prepackaged Software
QUIK,QuickLogic Corporation Common Stock,$5.92,-0.19,-3.11%,93749469.00,United States,1999,104203,Technology,Semiconductors
QURE,uniQure N.V. Ordinary Shares,$15.99,-0.23,-1.418%,875428451.00,Netherlands,2014,1011917,Health Care,Biotechnology: Pharmaceutical Preparations
QVCC,QVC Inc. 6.250% Senior Secured Notes due 2068,$8.31,-0.04,-0.479%,0.00,United States,2019,35671,Consumer Discretionary,Catalog/Specialty Distribution
QVCD,QVC Inc. 6.375% Senior Secured Notes due 2067,$8.38,0.01,0.119%,0.00,United States,2018,14351,Consumer Discretionary,Catalog/Specialty Distribution
QVCGA,QVC Group Inc. Series A Common Stock,$3.30,0.20,6.452%,26626809.00,United States,,192419,Consumer Discretionary,Catalog/Specialty Distribution
QVCGP,QVC Group Inc. 8.0% Fixed Rate Cumulative Redeemable Preferred Stock,$8.25,-0.13,-1.551%,66567023.00,United States,,54086,Consumer Discretionary,Catalog/Specialty Distribution
QXO,QXO Inc. Common Stock,$20.10,0.15,0.752%,11623136671.00,United States,,5913393,Technology,EDP Services
QXO^B,QXO Inc.  Depositary Shares each representing a 1/20th interest in a share of 5.50% Series B Mandatory Convertible Preferred Stock,$57.995,0.405,0.703%,,United States,,101259,,
R,Ryder System Inc. Common Stock,$149.65,-0.40,-0.267%,6186649523.00,United States,,319464,Consumer Discretionary,Rental/Leasing Companies
RA,Brookfield Real Assets Income Fund Inc. Common Stock,$12.88,-0.11,-0.847%,0.00,United States,2016,143572,Finance,Investment Managers
RAAQ,Real Asset Acquisition Corp. Class A Ordinary Share,$10.14,0.00,0.00%,0.00,United States,2025,831,,
RAAQU,Real Asset Acquisition Corp. Unit,$10.30,-0.01,-0.097%,0.00,United States,2025,752,Finance,Blank Checks
RAAQW,Real Asset Acquisition Corp. Warrants,$0.40,0.00,0.00%,0.00,United States,2025,28499,,
RAC,Rithm Acquisition Corp. Class A Ordinary Shares,$10.10,-0.01,-0.099%,0.00,,2025,46241,,
RACE,Ferrari N.V. Common Shares,$472.66,-9.73,-2.017%,114562009243.00,Italy,2015,471122,Consumer Discretionary,Auto Manufacturing
RADX,Radiopharm Theranostics Limited American Depositary Shares,$5.33,0.65,13.889%,11581880829.00,Australia,,62503,,
RAIL,FreightCar America Inc. Common Stock,$8.90,0.02,0.225%,169458759.00,United States,2005,174676,Industrials,Railroads
RAIN,Rain Enhancement Technologies Holdco Inc. Class A Common Stock,$3.43,-0.276,-7.447%,26021740.00,United States,,4039,Technology,Industrial Machinery/Components
RAINW,Rain Enhancement Technologies Holdco Inc. Warrants,$0.2009,0.0011,0.551%,1524130.00,United States,,1410,Technology,Industrial Machinery/Components
RAMP,LiveRamp Holdings Inc. Common Stock,$32.15,-0.81,-2.458%,2089485888.00,United States,2018,355361,Technology,EDP Services
RAND,Rand Capital Corporation Common Stock,$15.50,0.50,3.333%,46032117.00,United States,,2561,Finance,Finance: Consumer Services
RANG,Range Capital Acquisition Corp. Ordinary Shares,$10.45,0.00,0.00%,0.00,United States,2025,1,,
RANGU,Range Capital Acquisition Corp. Units,$10.70,0.30,2.885%,0.00,United States,2024,100,,
RANI,Rani Therapeutics Holdings Inc. Class A Common Stock,$0.5605,-0.0122,-2.13%,32252350.00,United States,2021,169153,Health Care,Biotechnology: Pharmaceutical Preparations
RAPP,Rapport Therapeutics Inc. Common Stock,$11.14,-0.96,-7.934%,406582763.00,United States,2024,190207,Health Care,Biotechnology: Pharmaceutical Preparations
RAPT,RAPT Therapeutics Inc. Common Stock,$1.09,-0.01,-0.909%,144194668.00,United States,2019,236907,Health Care,Biotechnology: Pharmaceutical Preparations
RARE,Ultragenyx Pharmaceutical Inc. Common Stock,$39.29,1.78,4.745%,3714556555.00,United States,2014,1919895,Health Care,Biotechnology: Pharmaceutical Preparations
RAVE,Rave Restaurant Group Inc. Common Stock,$2.465,-0.075,-2.953%,35031510.00,United States,,19039,Consumer Discretionary,Food Distributors
RAY,Raytech Holding Limited Ordinary Shares,$1.24,-0.04,-3.125%,21840223.00,Hong Kong,2024,178663,Consumer Discretionary,Consumer Electronics/Appliances
RAYA,Erayak Power Solution Group Inc. Class A Ordinary Shares,$2.0132,-0.0768,-3.675%,101844235.00,China,2022,191777,Consumer Discretionary,Metal Fabrications
RBA,RB Global Inc. Common Stock,$107.33,-0.22,-0.205%,20001264699.00,Canada,,674209,Consumer Discretionary,Business Services
RBB,RBB Bancorp Common Stock,$17.15,-0.24,-1.38%,304238582.00,United States,2017,32384,Finance,Major Banks
RBBN,Ribbon Communications Inc. Common Stock,$3.94,0.03,0.767%,695584881.00,United States,,552817,Technology,EDP Services
RBC,RBC Bearings Incorporated Common Stock,$371.75,-3.84,-1.022%,11701968062.00,United States,2022,80700,Industrials,Metal Fabrications
RBCAA,Republic Bancorp Inc. Class A Common Stock,$69.67,-0.99,-1.401%,1360294558.00,United States,1998,63735,Finance,Major Banks
RBKB,Rhinebeck Bancorp Inc. Common Stock,$12.40,0.28,2.31%,137620210.00,United States,2019,45256,Finance,Banks
RBLX,Roblox Corporation Class A Common Stock,$95.11,-1.06,-1.102%,64511621295.00,United States,2021,8674421,Technology,Computer Software: Prepackaged Software
RBNE,Robin Energy Ltd. Common Stock,$3.35,0.28,9.121%,7995552.00,Cyprus,,294863,Consumer Discretionary,Marine Transportation
RBOT,Vicarious Surgical Inc. Class A Common Stock,$8.70,0.62,7.673%,51608261.00,Hong Kong,2020,20356,Health Care,Industrial Specialties
RBRK,Rubrik Inc. Class A Common Stock,$88.74,-0.12,-0.135%,17170599879.00,United States,2024,2148152,Technology,Computer Software: Prepackaged Software
RC,Ready Capital Corporation Common Stock,$4.47,-0.05,-1.106%,762167305.00,United States,2013,1443771,Real Estate,Real Estate Investment Trusts
RC^C,Ready Capital Corporation 6.25% Series C Cumulative Convertible Preferred Stock,$15.30,0.18,1.19%,,United States,,1005,,
RC^E,Ready Capital Corporation 6.50% Series E Cumulative Redeemable Preferred Stock,$15.85,0.18,1.149%,,United States,,9435,,
RCAT,Red Cat Holdings Inc. Common Stock,$8.75,0.32,3.796%,795508569.00,United States,,12020000,Technology,Computer Software: Prepackaged Software
RCB,Ready Capital Corporation 6.20% Senior Notes due 2026,$24.04,0.09,0.376%,4098993737.00,United States,2019,11052,Real Estate,Real Estate Investment Trusts
RCC,Ready Capital Corporation 5.75% Senior Notes due 2026,$24.45,0.06,0.246%,4168901700.00,United States,2021,4575,Real Estate,Real Estate Investment Trusts
RCD,Ready Capital Corporation 9.00% Senior Notes due 2029,$23.00,0.11,0.481%,0.00,United States,2024,76930,Real Estate,Real Estate Investment Trusts
RCEL,Avita Medical Inc. Common Stock,$5.80,-0.26,-4.29%,153321016.00,United States,,151543,Health Care,Medical/Dental Instruments
RCG,RENN Fund Inc Common Stock,$2.62,0.023,0.886%,0.00,United States,,5591,Finance,Investment Managers
RCI,Rogers Communication Inc. Common Stock,$27.66,0.60,2.217%,14783375061.00,Canada,,1165731,Telecommunications,Cable & Other Pay Television Services
RCKT,Rocket Pharmaceuticals Inc. Common Stock,$3.07,0.04,1.32%,330755411.00,United States,2015,3287095,Health Care,Biotechnology: Pharmaceutical Preparations
RCKTW,Rocket Pharmaceuticals Inc. Warrant,$0.0381,-0.0009,-2.308%,4104815.00,United States,,3466,Health Care,Biotechnology: Pharmaceutical Preparations
RCKY,Rocky Brands Inc. Common Stock,$21.71,-0.79,-3.511%,161981936.00,United States,1993,38093,Consumer Discretionary,Shoe Manufacturing
RCL,Royal Caribbean Cruises Ltd. Common Stock,$265.73,-2.23,-0.832%,72161737652.00,United States,1993,1524668,Consumer Discretionary,Marine Transportation
RCMT,RCM Technologies Inc. Common Stock,$22.87,-0.02,-0.087%,169018105.00,United States,,15117,Consumer Discretionary,Professional Services
RCON,Recon Technology Ltd. Class A Ordinary Shares,$2.08,0.00,0.00%,31382955.00,China,2009,16538,Energy,Oilfield Services/Equipment
RCS,PIMCO Strategic Income Fund Inc.,$6.87,-0.15,-2.137%,0.00,United States,1994,180836,Finance,Investment Managers
RCT,RedCloud Holdings plc Ordinary Shares,$1.63,-0.06,-3.55%,72089415.00,United Kingdom,2025,17288,Consumer Discretionary,Other Specialty Stores
RCUS,Arcus Biosciences Inc. Common Stock,$9.35,0.27,2.974%,990026040.00,United States,2018,2864034,Health Care,Biotechnology: Pharmaceutical Preparations
RDACR,Rising Dragon Acquisition Corp. Rights,$0.1572,-0.0135,-7.909%,0.00,China,2024,1120,Finance,Blank Checks
RDAGU,Republic Digital Acquisition Company Unit,$10.62,0.09,0.855%,0.00,United States,2025,83733,Finance,Blank Checks
RDCM,Radcom Ltd. Ordinary Shares,$12.61,-0.20,-1.561%,200695918.00,Israel,1997,18446,Technology,Computer peripheral equipment
RDDT,Reddit Inc. Class A Common Stock,$116.20,1.17,1.017%,21441295114.00,United States,2024,4824351,Technology,EDP Services
RDFN,Redfin Corporation Common Stock,$11.04,0.30,2.793%,1413464216.00,United States,2017,7960653,Finance,Real Estate
RDGT,Ridgetech Inc. Ordinary Shares,$1.2298,0.0598,5.111%,8183184.00,China,,14394,Consumer Staples,Retail-Drug Stores and Proprietary Stores
RDHL,Redhill Biopharma Ltd. American Depositary Shares,$1.94,-0.06,-3.00%,4445615.00,Israel,,12698,Health Care,Biotechnology: Pharmaceutical Preparations
RDI,Reading International Inc Class A Common Stock,$1.37,-0.04,-2.837%,30792713.00,United States,,85384,Consumer Discretionary,Movies/Entertainment
RDIB,Reading International Inc Class B Common Stock,$9.60,-0.40,-4.00%,215773757.00,United States,,164,Consumer Discretionary,Movies/Entertainment
RDN,Radian Group Inc. Common Stock,$34.40,0.41,1.206%,4621093866.00,United States,,939222,Finance,Property-Casualty Insurers
RDNT,RadNet Inc. Common Stock,$56.58,-1.29,-2.229%,4245202945.00,United States,,458806,Health Care,Medical Specialities
RDUS,Radius Recycling Inc. Class A Common Stock,$29.49,-0.10,-0.338%,831676449.00,United States,,575226,Consumer Discretionary,Industrial Specialties
RDVT,Red Violet Inc. Common Stock ,$46.82,-0.52,-1.098%,653416081.00,United States,,74275,Technology,Computer Software: Prepackaged Software
RDW,Redwire Corporation Common Stock,$19.32,-0.74,-3.689%,1489251133.00,United States,2021,1922981,Industrials,Military/Government/Technical
RDWR,Radware Ltd. Ordinary Shares,$24.41,0.04,0.164%,1041978295.00,Israel,1999,61141,Consumer Discretionary,Business Services
RDY,Dr. Reddy's Laboratories Ltd Common Stock,$16.17,0.24,1.507%,13493143252.00,India,,2194969,Health Care,Biotechnology: Pharmaceutical Preparations
RDZN,Roadzen Inc. Ordinary Shares,$0.921,-0.0179,-1.906%,68329898.00,United States,2022,135638,Finance,Specialty Insurers
RDZNW,Roadzen Inc. Warrants,$0.0543,0.0066,13.836%,4028571.00,United States,2022,945,Finance,Specialty Insurers
REAL,The RealReal Inc. Common Stock,$5.33,-0.07,-1.296%,602798104.00,United States,2019,2921782,Consumer Discretionary,Other Specialty Stores
REAX,The Real Brokerage Inc. Common Shares,$4.16,-0.01,-0.24%,853985875.00,Canada,,760939,Finance,Real Estate
REBN,Reborn Coffee Inc. Common Stock,$2.60,-0.02,-0.763%,13788596.00,United States,2022,43904,Consumer Discretionary,Restaurants
RECT,Rectitude Holdings Ltd Ordinary Shares,$4.75,0.00,0.00%,68875000.00,Singapore,2024,1204,Consumer Discretionary,Industrial Machinery/Components
REE,REE Automotive Ltd. Class A Ordinary Shares,$0.692,-0.0501,-6.751%,21466485.00,Israel,,393801,Consumer Discretionary,Auto Manufacturing
REFI,Chicago Atlantic Real Estate Finance Inc. Common Stock,$14.22,0.07,0.495%,298157239.00,United States,2021,50545,Real Estate,Real Estate Investment Trusts
REFR,Research Frontiers Incorporated Common Stock,$1.90,-0.0155,-0.809%,63931620.00,United States,,19335,Miscellaneous,Multi-Sector Companies
REG,Regency Centers Corporation Common Stock,$71.06,0.05,0.07%,12899471276.00,United States,1993,896016,Real Estate,Real Estate Investment Trusts
REGCO,Regency Centers Corporation 5.875% Series B Cumulative Redeemable Preferred Stock,$22.28,0.07,0.315%,4044472559.00,United States,,344,Real Estate,Real Estate Investment Trusts
REGCP,Regency Centers Corporation 6.25% Series A Cumulative Redeemable Preferred Stock,$23.30,0.05,0.215%,4229632434.00,United States,,535,Real Estate,Real Estate Investment Trusts
REGN,Regeneron Pharmaceuticals Inc. Common Stock,$521.84,3.24,0.625%,56340714954.00,United States,1991,873334,Health Care,Biotechnology: Pharmaceutical Preparations
REI,Ring Energy Inc. Common Stock,$0.8425,0.0242,2.957%,173996898.00,United States,,2116438,Energy,Oil & Gas Production
REKR,Rekor Systems Inc. Common Stock,$1.37,0.00,0.00%,161764043.00,United States,,2263547,Telecommunications,Telecommunications Equipment
RELI,Reliance Global Group Inc. Common Stock,$1.25,-0.04,-3.101%,3718636.00,United States,,25050,Finance,Specialty Insurers
RELIW,Reliance Global Group Inc. Series A Warrants,$0.0195,-0.0005,-2.50%,58011.00,United States,,1401,Finance,Specialty Insurers
RELL,Richardson Electronics Ltd. Common Stock,$9.19,-0.19,-2.026%,132106250.00,United States,1983,19239,Technology,Electronic Components
RELX,RELX PLC PLC American Depositary Shares (Each representing One Ordinary Share),$53.26,0.29,0.547%,98314372034.00,United Kingdom,2015,668639,Consumer Discretionary,Business Services
RELY,Remitly Global Inc. Common Stock,$19.92,-0.14,-0.698%,4060863153.00,United States,2021,2998706,Consumer Discretionary,Business Services
RENB,Renovaro Inc. Common Stock,$0.3796,0.0349,10.125%,65336209.00,United States,,6002628,Health Care,Biotechnology: Pharmaceutical Preparations
RENT,Rent the Runway Inc. Class A Common Stock,$5.79,-0.21,-3.50%,23286732.00,United States,2021,43684,Consumer Discretionary,Other Specialty Stores
REPL,Replimune Group Inc. Common Stock,$9.885,0.105,1.074%,762002524.00,United States,2018,1055760,Health Care,Biotechnology: Biological Products (No Diagnostic Substances)
REPX,Riley Exploration Permian Inc. Common Stock,$28.31,-0.15,-0.527%,623472149.00,United States,1999,67604,Energy,Oil & Gas Production
RERE,ATRenew Inc. American Depositary Shares (every three of which representing two Class A ordinary shares),$2.75,0.09,3.383%,604494927.00,Cayman Islands,2021,713000,Consumer Discretionary,Other Specialty Stores
RES,RPC Inc. Common Stock,$4.87,-0.08,-1.616%,1074149144.00,United States,,1149935,Energy,Oilfield Services/Equipment
RETO,ReTo Eco-Solutions Inc. Class A Shares,$3.44,0.01,0.292%,26363744.00,China,2017,10166,Industrials,Industrial Machinery/Components
REVB,Revelation Biosciences Inc. Common Stock,$0.805,-0.0259,-3.117%,775856.00,United States,2020,394362,Health Care,Biotechnology: Pharmaceutical Preparations
REVBW,Revelation Biosciences Inc. Warrant,$0.012,0.0001,0.84%,11566.00,United States,2020,32438,Health Care,Biotechnology: Pharmaceutical Preparations
REVG,REV Group Inc. Common Stock,$45.04,-0.07,-0.155%,2197832689.00,United States,2017,567331,Consumer Discretionary,Auto Manufacturing
REX,REX American Resources Corporation,$45.09,-0.43,-0.945%,742580852.00,United States,,83645,Industrials,Major Chemicals
REXR,Rexford Industrial Realty Inc. Common Stock,$36.94,0.26,0.709%,8743145673.00,United States,2013,1767977,Real Estate,Real Estate Investment Trusts
REXR^B,Rexford Industrial Realty Inc. 5.875% Series B Cumulative Redeemable Preferred Stock,$22.95,0.1565,0.687%,,United States,,2618,,
REXR^C,Rexford Industrial Realty Inc. 5.625% Series C Cumulative Redeemable Preferred Stock par value $0.01 per share,$21.5242,0.0531,0.247%,,United States,,1879,,
REYN,Reynolds Consumer Products Inc. Common Stock,$21.72,-0.03,-0.138%,4568221490.00,United States,2020,958245,Consumer Discretionary,Containers/Packaging
REZI,Resideo Technologies Inc. Common Stock ,$21.08,-0.09,-0.425%,3130454497.00,United States,2018,929639,Industrials,Wholesale Distributors
RF,Regions Financial Corporation Common Stock,$22.08,-0.21,-0.942%,19848377800.00,United States,,8155256,Finance,Major Banks
RF^C,Regions Financial Corporation Depositary Shares each Representing a 1/40th Interest in a  Share of 5.700% Fixed-to-Floating Rate Non-Cumulative  Perpetual Preferred Stock Series C,$24.01,-0.04,-0.166%,,United States,,31899,,
RF^E,Regions Financial Corporation Depositary Shares Each Representing a 1/40th Interest in a Share of 4.45% Non-Cumulative Perpetual Preferred Stock Series E,$17.25,-0.01,-0.058%,,United States,,18433,,
RF^F,Regions Financial Corporation Depositary Shares Each Representing a 1/40th Interest in a Share of Non-Cumulative Perpetual Preferred Stock Series F,$25.08,0.09,0.36%,,United States,,38054,,
RFAI,RF Acquisition Corp II Ordinary Shares,$10.5154,-0.0046,-0.044%,0.00,Singapore,2024,1504,,
RFAIR,RF Acquisition Corp II Right,$0.0664,-0.0118,-15.09%,0.00,Singapore,2024,1689,Technology,Computer Software: Prepackaged Software
RFI,Cohen & Steers Total Return Realty Fund Inc. Common Stock,$12.00,-0.0052,-0.043%,589663536.00,United States,1993,53117,Finance,Investment Managers
RFIL,RF Industries Ltd. Common Stock,$4.24,0.12,2.913%,45240278.00,United States,,20452,Technology,Electrical Products
RFL,Rafael Holdings Inc. Class B Common Stock,$2.20,0.14,6.796%,77198887.00,United States,2018,496572,Finance,Real Estate
RFM,RiverNorth Flexible Municipal Income Fund Inc. Common Stock,$14.13,0.03,0.213%,86400697.00,,2020,16712,Finance,Finance/Investors Services
RFMZ,RiverNorth Flexible Municipal Income Fund II Inc. Common Stock,$12.76,0.03,0.236%,310728407.00,,2021,113449,Finance,Trusts Except Educational Religious and Charitable
RGA,Reinsurance Group of America Incorporated Common Stock,$198.96,0.71,0.358%,13148464790.00,United States,,309417,Finance,Life Insurance
RGC,Regencell Bioscience Holdings Limited Ordinary Shares,$610.50,-12.10,-1.943%,7944354693.00,Hong Kong,2021,27471,Health Care, Medicinal Chemicals and Botanical Products 
RGCO,RGC Resources Inc. Common Stock,$20.67,0.15,0.731%,213140627.00,United States,,3791,Utilities,Oil & Gas Production
RGEN,Repligen Corporation Common Stock,$131.30,-0.70,-0.53%,7376841030.00,United States,1986,386401,Health Care,Biotechnology: Biological Products (No Diagnostic Substances)
RGLD,Royal Gold Inc. Common Stock,$179.03,4.47,2.561%,11783127279.00,United States,,406212,Industrials,Precious Metals
RGLS,Regulus Therapeutics Inc. Common Stock,$8.08,-0.07,-0.859%,559411439.00,United States,2012,1267614,Health Care,Biotechnology: Pharmaceutical Preparations
RGNX,REGENXBIO Inc. Common Stock,$10.20,0.00,0.00%,511635590.00,United States,2015,542997,Health Care,Biotechnology: Biological Products (No Diagnostic Substances)
RGP,Resources Connection Inc. Common Stock,$5.51,-0.02,-0.362%,182211711.00,United States,,131246,Consumer Discretionary,Business Services
RGR,Sturm Ruger & Company Inc. Common Stock,$37.86,0.02,0.053%,626770861.00,United States,,108706,Industrials,Ordnance And Accessories
RGS,Regis Corporation Common Stock,$22.59,0.10,0.445%,55028811.00,United States,1991,3591,Consumer Discretionary,Other Consumer Services
RGT,Royce Global Trust Inc. Common Stock,$11.769,0.019,0.162%,73755652.00,,2013,28429,Finance,Trusts Except Educational Religious and Charitable
RGTI,Rigetti Computing Inc. Common Stock,$12.10,-0.42,-3.355%,3512906957.00,United States,,93622234,Technology,EDP Services
RGTIW,Rigetti Computing Inc. Warrants,$4.57,-0.11,-2.35%,1326775603.00,United States,,654978,Technology,EDP Services
RH,RH Common Stock,$176.87,-2.11,-1.179%,3312502013.00,United States,2012,3606062,Consumer Discretionary,Other Specialty Stores
RHI,Robert Half Inc. Common Stock,$43.79,-0.21,-0.477%,4473751138.00,United States,,1040871,Consumer Discretionary,Professional Services
RHLD,Resolute Holdings Management Common Stock ,$37.68,-2.15,-5.398%,321259605.00,United States,,46242,Finance,Finance: Consumer Services
RHP,Ryman Hospitality Properties Inc. (REIT),$98.15,-0.47,-0.477%,5889084900.00,United States,,521603,Real Estate,Real Estate Investment Trusts
RIBBU,Ribbon Acquisition Corp Unit,$10.27,-0.11,-1.06%,0.00,Japan,2025,2034,,
RICK,RCI Hospitality Holdings Inc. Common Stock,$41.87,-0.585,-1.378%,368382728.00,United States,1995,49854,Consumer Discretionary,Restaurants
RIG,Transocean Ltd (Switzerland) Common Stock,$3.21,0.01,0.313%,2835269274.00,Switzerland,,50780282,Energy,Oil & Gas Production
RIGL,Rigel Pharmaceuticals Inc. Common Stock,$21.30,0.11,0.519%,380682802.00,United States,2000,110819,Health Care,Biotechnology: Pharmaceutical Preparations
